{
  "workflow_id": "workflow-7120df71defd",
  "name": "workflow-7120df71defd",
  "atom_registry_snapshot_id": "atomreg:sha256:922ece4661f84e11",
  "steps": [
    {
      "step_id": "contextualize_findings_with_literature",
      "parameters": {},
      "dependencies": [
        "diversity_analysis",
        "review_prior_work"
      ],
      "estimated_duration": 1800
    },
    {
      "step_id": "data_acquisition",
      "parameters": {},
      "dependencies": [],
      "estimated_duration": 1800
    },
    {
      "step_id": "discover_sequence_trimming",
      "parameters": {},
      "dependencies": [
        "survey_method_landscape"
      ],
      "estimated_duration": 1800
    },
    {
      "step_id": "discover_taxonomic_classification",
      "parameters": {},
      "dependencies": [
        "survey_method_landscape"
      ],
      "estimated_duration": 1800
    },
    {
      "step_id": "diversity_analysis",
      "parameters": {},
      "dependencies": [
        "taxonomic_classification"
      ],
      "estimated_duration": 1800
    },
    {
      "step_id": "final_reporting",
      "parameters": {},
      "dependencies": [
        "reporting"
      ],
      "estimated_duration": 1800
    },
    {
      "step_id": "raw_qc",
      "parameters": {},
      "dependencies": [
        "data_acquisition"
      ],
      "estimated_duration": 1800
    },
    {
      "step_id": "reporting",
      "parameters": {},
      "dependencies": [
        "contextualize_findings_with_literature",
        "diversity_analysis"
      ],
      "estimated_duration": 1800
    },
    {
      "step_id": "review_prior_work",
      "parameters": {},
      "dependencies": [],
      "estimated_duration": 1800
    },
    {
      "step_id": "sequence_trimming",
      "parameters": {},
      "dependencies": [
        "discover_sequence_trimming",
        "raw_qc"
      ],
      "estimated_duration": 1800
    },
    {
      "step_id": "survey_method_landscape",
      "parameters": {},
      "dependencies": [
        "data_acquisition",
        "raw_qc"
      ],
      "estimated_duration": 1800
    },
    {
      "step_id": "taxonomic_classification",
      "parameters": {},
      "dependencies": [
        "discover_taxonomic_classification",
        "sequence_trimming"
      ],
      "estimated_duration": 1800
    },
    {
      "step_id": "validate_contextualize_findings_with_literature",
      "parameters": {},
      "dependencies": [
        "contextualize_findings_with_literature"
      ],
      "estimated_duration": 1800
    },
    {
      "step_id": "validate_data_acquisition",
      "parameters": {},
      "dependencies": [
        "data_acquisition"
      ],
      "estimated_duration": 1800
    },
    {
      "step_id": "validate_diversity_analysis",
      "parameters": {},
      "dependencies": [
        "diversity_analysis"
      ],
      "estimated_duration": 1800
    },
    {
      "step_id": "validate_final_reporting",
      "parameters": {},
      "dependencies": [
        "final_reporting"
      ],
      "estimated_duration": 1800
    },
    {
      "step_id": "validate_raw_qc",
      "parameters": {},
      "dependencies": [
        "raw_qc"
      ],
      "estimated_duration": 1800
    },
    {
      "step_id": "validate_reporting",
      "parameters": {},
      "dependencies": [
        "reporting"
      ],
      "estimated_duration": 1800
    },
    {
      "step_id": "validate_review_prior_work",
      "parameters": {},
      "dependencies": [
        "review_prior_work"
      ],
      "estimated_duration": 1800
    },
    {
      "step_id": "validate_sequence_trimming",
      "parameters": {},
      "dependencies": [
        "sequence_trimming"
      ],
      "estimated_duration": 1800
    },
    {
      "step_id": "validate_taxonomic_classification",
      "parameters": {},
      "dependencies": [
        "taxonomic_classification"
      ],
      "estimated_duration": 1800
    }
  ],
  "edges": [
    {
      "edge_id": "contextualize_findings_with_literature.out->reporting.in",
      "source_node_id": "contextualize_findings_with_literature",
      "target_node_id": "reporting",
      "source_output": "out",
      "target_input": "in"
    },
    {
      "edge_id": "contextualize_findings_with_literature.out->validate_contextualize_findings_with_literature.in",
      "source_node_id": "contextualize_findings_with_literature",
      "target_node_id": "validate_contextualize_findings_with_literature",
      "source_output": "out",
      "target_input": "in"
    },
    {
      "edge_id": "data_acquisition.out->raw_qc.in",
      "source_node_id": "data_acquisition",
      "target_node_id": "raw_qc",
      "source_output": "out",
      "target_input": "in"
    },
    {
      "edge_id": "data_acquisition.out->survey_method_landscape.in",
      "source_node_id": "data_acquisition",
      "target_node_id": "survey_method_landscape",
      "source_output": "out",
      "target_input": "in"
    },
    {
      "edge_id": "data_acquisition.out->validate_data_acquisition.in",
      "source_node_id": "data_acquisition",
      "target_node_id": "validate_data_acquisition",
      "source_output": "out",
      "target_input": "in"
    },
    {
      "edge_id": "discover_sequence_trimming.out->sequence_trimming.in",
      "source_node_id": "discover_sequence_trimming",
      "target_node_id": "sequence_trimming",
      "source_output": "out",
      "target_input": "in"
    },
    {
      "edge_id": "discover_taxonomic_classification.out->taxonomic_classification.in",
      "source_node_id": "discover_taxonomic_classification",
      "target_node_id": "taxonomic_classification",
      "source_output": "out",
      "target_input": "in"
    },
    {
      "edge_id": "diversity_analysis.out->contextualize_findings_with_literature.in",
      "source_node_id": "diversity_analysis",
      "target_node_id": "contextualize_findings_with_literature",
      "source_output": "out",
      "target_input": "in"
    },
    {
      "edge_id": "diversity_analysis.out->reporting.in",
      "source_node_id": "diversity_analysis",
      "target_node_id": "reporting",
      "source_output": "out",
      "target_input": "in"
    },
    {
      "edge_id": "diversity_analysis.out->validate_diversity_analysis.in",
      "source_node_id": "diversity_analysis",
      "target_node_id": "validate_diversity_analysis",
      "source_output": "out",
      "target_input": "in"
    },
    {
      "edge_id": "final_reporting.out->validate_final_reporting.in",
      "source_node_id": "final_reporting",
      "target_node_id": "validate_final_reporting",
      "source_output": "out",
      "target_input": "in"
    },
    {
      "edge_id": "raw_qc.out->sequence_trimming.in",
      "source_node_id": "raw_qc",
      "target_node_id": "sequence_trimming",
      "source_output": "out",
      "target_input": "in"
    },
    {
      "edge_id": "raw_qc.out->survey_method_landscape.in",
      "source_node_id": "raw_qc",
      "target_node_id": "survey_method_landscape",
      "source_output": "out",
      "target_input": "in"
    },
    {
      "edge_id": "raw_qc.out->validate_raw_qc.in",
      "source_node_id": "raw_qc",
      "target_node_id": "validate_raw_qc",
      "source_output": "out",
      "target_input": "in"
    },
    {
      "edge_id": "reporting.out->final_reporting.in",
      "source_node_id": "reporting",
      "target_node_id": "final_reporting",
      "source_output": "out",
      "target_input": "in"
    },
    {
      "edge_id": "reporting.out->validate_reporting.in",
      "source_node_id": "reporting",
      "target_node_id": "validate_reporting",
      "source_output": "out",
      "target_input": "in"
    },
    {
      "edge_id": "review_prior_work.out->contextualize_findings_with_literature.in",
      "source_node_id": "review_prior_work",
      "target_node_id": "contextualize_findings_with_literature",
      "source_output": "out",
      "target_input": "in"
    },
    {
      "edge_id": "review_prior_work.out->validate_review_prior_work.in",
      "source_node_id": "review_prior_work",
      "target_node_id": "validate_review_prior_work",
      "source_output": "out",
      "target_input": "in"
    },
    {
      "edge_id": "sequence_trimming.out->taxonomic_classification.in",
      "source_node_id": "sequence_trimming",
      "target_node_id": "taxonomic_classification",
      "source_output": "out",
      "target_input": "in"
    },
    {
      "edge_id": "sequence_trimming.out->validate_sequence_trimming.in",
      "source_node_id": "sequence_trimming",
      "target_node_id": "validate_sequence_trimming",
      "source_output": "out",
      "target_input": "in"
    },
    {
      "edge_id": "survey_method_landscape.out->discover_sequence_trimming.in",
      "source_node_id": "survey_method_landscape",
      "target_node_id": "discover_sequence_trimming",
      "source_output": "out",
      "target_input": "in"
    },
    {
      "edge_id": "survey_method_landscape.out->discover_taxonomic_classification.in",
      "source_node_id": "survey_method_landscape",
      "target_node_id": "discover_taxonomic_classification",
      "source_output": "out",
      "target_input": "in"
    },
    {
      "edge_id": "taxonomic_classification.out->diversity_analysis.in",
      "source_node_id": "taxonomic_classification",
      "target_node_id": "diversity_analysis",
      "source_output": "out",
      "target_input": "in"
    },
    {
      "edge_id": "taxonomic_classification.out->validate_taxonomic_classification.in",
      "source_node_id": "taxonomic_classification",
      "target_node_id": "validate_taxonomic_classification",
      "source_output": "out",
      "target_input": "in"
    }
  ],
  "parameter_mappings": [
    {
      "source_step": "diversity_analysis",
      "source_output": "out",
      "target_step": "contextualize_findings_with_literature",
      "target_input": "in"
    },
    {
      "source_step": "review_prior_work",